{
  "connections":[],
  "devices":[
    {
      "description":"Main molded-case circuit breaker 250 A",
      "function":"power",
      "id":"device_a6fb254446f7",
      "location":"cabinet",
      "part_id":"MCCB_MAIN_250A",
      "properties":{},
      "tag":"QF1",
      "terminal_ids":[
        "L1",
        "L2",
        "L3",
        "T1",
        "T2",
        "T3"
      ]
    },
    {
      "description":"24 VDC control power supply 120 W",
      "function":"control",
      "id":"device_a68efeadd3b2",
      "location":"cabinet",
      "part_id":"PSU_24V_120W",
      "properties":{},
      "tag":"G1",
      "terminal_ids":[
        "L",
        "N",
        "PE",
        "+24",
        "0V"
      ]
    },
    {
      "description":"Compact PLC CPU",
      "function":"plc",
      "id":"device_e31f877b1100",
      "location":"cabinet",
      "part_id":"PLC_CPU",
      "properties":{},
      "tag":"PLC1",
      "terminal_ids":[
        "+24",
        "0V",
        "DI_COM",
        "DO_COM"
      ]
    },
    {
      "description":"16-channel PLC I/O module",
      "function":"plc",
      "id":"device_06aee16f8cbc",
      "location":"cabinet",
      "part_id":"PLC_IO_16",
      "properties":{},
      "tag":"IO1",
      "terminal_ids":[
        "+24",
        "0V",
        "I1",
        "O1"
      ]
    },
    {
      "description":"16-channel PLC I/O module",
      "function":"plc",
      "id":"device_42a9a7d4040c",
      "location":"cabinet",
      "part_id":"PLC_IO_16",
      "properties":{},
      "tag":"IO2",
      "terminal_ids":[
        "+24",
        "0V",
        "I1",
        "O1"
      ]
    },
    {
      "description":"Four changeover interface relay",
      "function":"control",
      "id":"device_bf877bf3f2fc",
      "location":"cabinet",
      "part_id":"RELAY_4CO",
      "properties":{},
      "tag":"KA1",
      "terminal_ids":[
        "A1",
        "A2",
        "11",
        "14"
      ]
    },
    {
      "description":"Four changeover interface relay",
      "function":"control",
      "id":"device_2573819967f2",
      "location":"cabinet",
      "part_id":"RELAY_4CO",
      "properties":{},
      "tag":"KA2",
      "terminal_ids":[
        "A1",
        "A2",
        "11",
        "14"
      ]
    },
    {
      "description":"Four changeover interface relay",
      "function":"control",
      "id":"device_eeb1b7c48762",
      "location":"cabinet",
      "part_id":"RELAY_4CO",
      "properties":{},
      "tag":"KA3",
      "terminal_ids":[
        "A1",
        "A2",
        "11",
        "14"
      ]
    },
    {
      "description":"Four changeover interface relay",
      "function":"control",
      "id":"device_3fad345a44b9",
      "location":"cabinet",
      "part_id":"RELAY_4CO",
      "properties":{},
      "tag":"KA4",
      "terminal_ids":[
        "A1",
        "A2",
        "11",
        "14"
      ]
    }
  ],
  "ducts":[
    {
      "height":1100.0,
      "id":"duct_7c54f57a66b5",
      "kind":"wire_duct",
      "width":45.0,
      "x":50.0,
      "y":50.0
    },
    {
      "height":1100.0,
      "id":"duct_a4f3cebcfb31",
      "kind":"wire_duct",
      "width":45.0,
      "x":505.0,
      "y":50.0
    },
    {
      "height":40.0,
      "id":"duct_26efbcbc195b",
      "kind":"wire_duct",
      "width":500.0,
      "x":50.0,
      "y":285.0
    }
  ],
  "enclosure":{
    "depth":300.0,
    "height":1200.0,
    "id":"enclosure",
    "plate_margin":50.0,
    "reserve_percent":20.0,
    "width":600.0
  },
  "id":"project_4de34d02badc",
  "metadata":{
    "intent_provider":"mock-regex",
    "intent_schema":"design-intent.v1",
    "source_prompt":"PLC control cabinet 600x1200x300 mm with 20% spare"
  },
  "name":"Electrical control panel",
  "parts":[
    {
      "aliases":[],
      "category":"breaker",
      "description":"Main molded-case circuit breaker 250 A",
      "footprint":{
        "allowed_rotations":[
          0
        ],
        "clearance_mm":0.0,
        "depth":90.0,
        "height":160.0,
        "keepout_bottom":3.0,
        "keepout_left":3.0,
        "keepout_right":3.0,
        "keepout_top":3.0,
        "mounting":"backplate",
        "width":105.0
      },
      "footprint_ref":"footprints/MCCB_MAIN_250A",
      "id":"MCCB_MAIN_250A",
      "manufacturer":"CNB-GENERIC",
      "manufacturer_part":"CNB-MCCB-250",
      "provenance":{},
      "ratings":{
        "current":"250A",
        "poles":"3"
      },
      "symbol_ref":"symbols/breaker/MCCB_MAIN_250A",
      "terminals":[
        {
          "id":"L1",
          "kind":"power",
          "name":"Line 1"
        },
        {
          "id":"L2",
          "kind":"power",
          "name":"Line 2"
        },
        {
          "id":"L3",
          "kind":"power",
          "name":"Line 3"
        },
        {
          "id":"T1",
          "kind":"power",
          "name":"Load 1"
        },
        {
          "id":"T2",
          "kind":"power",
          "name":"Load 2"
        },
        {
          "id":"T3",
          "kind":"power",
          "name":"Load 3"
        }
      ]
    },
    {
      "aliases":[],
      "category":"plc",
      "description":"Compact PLC CPU",
      "footprint":{
        "allowed_rotations":[
          0
        ],
        "clearance_mm":0.0,
        "depth":80.0,
        "height":100.0,
        "keepout_bottom":3.0,
        "keepout_left":3.0,
        "keepout_right":3.0,
        "keepout_top":3.0,
        "mounting":"din_rail",
        "rail_width":35.0,
        "width":90.0
      },
      "footprint_ref":"footprints/PLC_CPU",
      "id":"PLC_CPU",
      "manufacturer":"CNB-GENERIC",
      "manufacturer_part":"CNB-PLC-CPU",
      "provenance":{},
      "ratings":{},
      "symbol_ref":"symbols/plc/PLC_CPU",
      "terminals":[
        {
          "id":"+24",
          "kind":"control",
          "name":"+24 V"
        },
        {
          "id":"0V",
          "kind":"control",
          "name":"0 V"
        },
        {
          "id":"DI_COM",
          "kind":"signal",
          "name":"DI common"
        },
        {
          "id":"DO_COM",
          "kind":"signal",
          "name":"DO common"
        }
      ]
    },
    {
      "aliases":[],
      "category":"plc",
      "description":"16-channel PLC I/O module",
      "footprint":{
        "allowed_rotations":[
          0
        ],
        "clearance_mm":0.0,
        "depth":80.0,
        "height":100.0,
        "keepout_bottom":3.0,
        "keepout_left":3.0,
        "keepout_right":3.0,
        "keepout_top":3.0,
        "mounting":"din_rail",
        "rail_width":35.0,
        "width":90.0
      },
      "footprint_ref":"footprints/PLC_IO_16",
      "id":"PLC_IO_16",
      "manufacturer":"CNB-GENERIC",
      "manufacturer_part":"CNB-PLC-IO16",
      "provenance":{},
      "ratings":{},
      "symbol_ref":"symbols/plc/PLC_IO_16",
      "terminals":[
        {
          "id":"+24",
          "kind":"control",
          "name":"+24 V"
        },
        {
          "id":"0V",
          "kind":"control",
          "name":"0 V"
        },
        {
          "id":"I1",
          "kind":"signal",
          "name":"Input 1"
        },
        {
          "id":"O1",
          "kind":"signal",
          "name":"Output 1"
        }
      ]
    },
    {
      "aliases":[],
      "category":"power_supply",
      "description":"24 VDC control power supply 120 W",
      "footprint":{
        "allowed_rotations":[
          0
        ],
        "clearance_mm":0.0,
        "depth":90.0,
        "height":100.0,
        "keepout_bottom":3.0,
        "keepout_left":3.0,
        "keepout_right":3.0,
        "keepout_top":3.0,
        "mounting":"din_rail",
        "rail_width":35.0,
        "width":72.0
      },
      "footprint_ref":"footprints/PSU_24V_120W",
      "id":"PSU_24V_120W",
      "manufacturer":"CNB-GENERIC",
      "manufacturer_part":"CNB-PSU-24-120",
      "provenance":{},
      "ratings":{
        "output":"24VDC 5A"
      },
      "symbol_ref":"symbols/power_supply/PSU_24V_120W",
      "terminals":[
        {
          "id":"L",
          "kind":"power",
          "name":"Line"
        },
        {
          "id":"N",
          "kind":"power",
          "name":"Neutral"
        },
        {
          "id":"PE",
          "kind":"protective_earth",
          "name":"Earth"
        },
        {
          "id":"+24",
          "kind":"control",
          "name":"+24 V"
        },
        {
          "id":"0V",
          "kind":"control",
          "name":"0 V"
        }
      ]
    },
    {
      "aliases":[],
      "category":"relay",
      "description":"Four changeover interface relay",
      "footprint":{
        "allowed_rotations":[
          0
        ],
        "clearance_mm":0.0,
        "depth":70.0,
        "height":80.0,
        "keepout_bottom":3.0,
        "keepout_left":3.0,
        "keepout_right":3.0,
        "keepout_top":3.0,
        "mounting":"din_rail",
        "rail_width":35.0,
        "width":18.0
      },
      "footprint_ref":"footprints/RELAY_4CO",
      "id":"RELAY_4CO",
      "manufacturer":"CNB-GENERIC",
      "manufacturer_part":"CNB-RELAY-4CO",
      "provenance":{},
      "ratings":{},
      "symbol_ref":"symbols/relay/RELAY_4CO",
      "terminals":[
        {
          "id":"A1",
          "kind":"control",
          "name":"Coil +"
        },
        {
          "id":"A2",
          "kind":"control",
          "name":"Coil -"
        },
        {
          "id":"11",
          "kind":"signal",
          "name":"COM"
        },
        {
          "id":"14",
          "kind":"signal",
          "name":"NO"
        }
      ]
    }
  ],
  "placements":[
    {
      "device_id":"device_06aee16f8cbc",
      "locked":false,
      "rail_id":"rail_5294e7104596",
      "rotation":0,
      "x":215.0,
      "y":165.0,
      "zone":"control"
    },
    {
      "device_id":"device_2573819967f2",
      "locked":false,
      "rail_id":"rail_5135d0e2abe6",
      "rotation":0,